job_title,job_category,job_description,job_link,job_detail
"
Policy Advocate, Africa Region at International Center for Research on Women (ICRW)
",Engineering ,"
International Center for Research on Women (ICRW) is looking to recruit qualified applicants for Policy Advocate, Africa Region role ",https://www.myjobmag.co.ke/jobs/policy-advocate-africa-region-at-international-center-for-research-on-women-icrw,"
Position Description And Rationale

As the world prepares to mark the 25 th anniversary of the Beijing Declaration and Platform for Action via a process set to include two hallmark events known as the Generation Equality Forum, ICRW seeks a Nairobi-based advocate support feminist organizing and the development of progressive policy commitments at the Kenya national level and potentially regionally as well. Building on recent work to identify strategies for the development of an advocacy program in ICRW’s Africa Regional Office, this position will with ICRW’s Global Advocacy team and Africa Regional Office leadership and research team to leverage our research base and policy analysis expertise to support the development of bold, transformative commitments in line with the goals of the 6 Action Coalitions that will emerge from the Generation Equality Forum.

Objectives

The Advocate will support the Senior Director, Policy and Advocacy and Senior Consultant, Global Policy in creating linkages with existing women’s rights and development advocates engaging in advocacy on gender equality at the national level with the Generation Equality Forum process and associated Action Coalitions, with a goal to helping develop bold, transformative actions by the Kenyan government for women’s rights, in consultation with the national and regional feminist movement, and in line with existing (ICRW and other) evidence of what is necessary and impactful.

Length of the assignment:  6 months to1 year.

Generation Equality Forum Support

Specific responsibilities of the Advocate 

The Advocate’s role will be to support ICRW’s Africa Regional Office engagement in the Generation Equality Forum process, and to support its Senior Director of Policy and Advocacy, Senior Global Policy Consultant and Africa Regional Director in strategic, national-level advocacy efforts toward Kenyan leadership in the Beijing+25 and Generation Equality Forum process  .  This includes policy analysis, network mapping, research synthesis, advocacy with the Kenyan Government and coalition organizing and coordination with allied activists working to advance gender equality and women’s rights.

Action Coalition Support

The Advocate will assist the Action Coalition process including researching and refining proposed policy commitments for the Kenyan government, coordinating with other gender equality advocates pushing for such commitments nationally, and linking between Kenyan national, regional and global Action Coalition events, goals, networks and opportunities.

External Consultations

The consultant will conduct outreach to prospective partner organizations engaged in the Generation Equality Forum and Action Coalition advocacy space to assess their current campaigns and identify opportunities for ICRW to bring a research-based, data driven and feminist f lens to that work. As necessary, the Advocate will also conduct targeted meetings with official representatives of relevant line ministries in the Kenyan Government, UN agencies and partner organizations, and/or support the Africa Regional Office Director in her execution of such meetings. Some travel may be required for the fulfillment of duties relevant to the Generation Equality Forum process.

Education

Minimum of a bachelor’s degree in international affairs, development studies, economics, or other social science. Master’s degree preferred.

Experience

Three years of directly relevant work experience with master’s degree or five years of directly relevant work experience with bachelor’s degree. Demonstrated knowledge of policy-making processes at the federal, regional and/or global levels and one to three years of work experience on initiatives to influence those processes. Experience with coalition advocacy, feminist organizing and communicating for press and policy audiences essential. A background in sustainable development, particularly related to gender equality, a plus

Skills

Proficiency in the MS Office Suite (Word, Excel, PowerPoint, Outlook).
Strong written and oral communications skills, as well as excellent writing, editing and proofreading skills required. Must possess strong skills in report writing and editing, visual presentation of research findings, and strategic planning.
Must be detail oriented, flexible, and able to take initiative.
Ability to work both independently and in close coordination with and across teams. Good interpersonal skills and ability to work collaboratively required.
Demonstrated ability to prioritize and complete multiple tasks.
Social media skills, particularly Twitter, strongly recommended.
Fluency or good reading comprehension in a foreign language a plus.

Interested applicants should submit a cover letter, resume and writing sample.

Due to the large volume of responses we receive, ICRW is not able to provide candidacy status on an individual basis. Only candidates selected for an interview will be contacted.

ICRW is an equal opportunity employer. All qualified applicants will receive consideration for employment without regard to race, color, age, religion, sex, sexual orientation, gender identity/expression, national origin, disability, protected veteran status, or any other characteristic protected under federal, state or local law, where applicable. ICRW is an E-Verify Employer.
"
"
Corporate Finance Analyst at British American Tobacco
",Manufacturing ,"
Few companies founded in 1902 are still going from strength to strength. Fewer still are leaders in more than 55 markets. And with one billion adult smokers around the world, we manufacture the cigare ",https://www.myjobmag.co.ke/jobs/corporate-finance-analyst-at-british-american-tobacco-1,"
Purpose Statement
 
Execute the delivery of specific elements of accounts payable tasks ensuring a high level of accuracy and timeliness. The role requires liaison with internal and external stakeholders. The job holder will need to ensure process compliance so that source system data is complete and accurate as well as adhering to policies, procedures and accounting standards
 Key Accountabilities:

Application of the accounting policies and procedures to ensure good service delivery
Good understanding of BAT Reporting requirements and following them
Created good relationship with the suppliers for payment of their invoices.
Ensure that invoices are collected from the gate by the registry, recorded and scanned in good time. Ensure no invoices are held for too long without being actioned on by the concerned party.
 Ensure that the invoices meet the requirements of a tax invoice before scanning
 Engage the procurement department to ensure that the master data is accurately maintained with the correct supplier details
Coordinate with both GBS and SAP administrators to update the master data entries for vendors as and when the need arises.
Liaison with Shared service centre in a context of highly demanding workflow.

Knowledge, Skills and Experience

A relevant degree with professional accounting qualification – CA, ACCA, CIMA, CPA
Minimum of 2 years’ experience in a Finance Shared Services – Accounts Payable, Accounts Receivables, Tax Sections
Good accounting, analytical and numeracy skills
Good underGood accounting, analytical and numeracy skillsstanding of computer software packages like Microsoft Word, Advanced excel
Working knowledge of Company Law and Tax regulations
Working knowledge of SAP is an added advantage
Good understanding of accounting policies and procedures
Ability to communicate effectively

"
"
Consultancy For Provision Of Accounting Services at Triggerise
",NGO ,"
Triggerise is a non-profit that motivates users – primarily young women and adolescent girls – to make positive choices. We use nudges like reminders, discounts, in person and digital foll ",https://www.myjobmag.co.ke/jobs/consultancy-for-provision-of-accounting-services-at-triggerise,"
Background information
Triggerise is registered in Kenya under the Kenya Companies Act with a Certificate of Registration Number PVT/2016/025180 dated September 16th, 2016 as a subsidiary of Triggerise BV. Triggerise Kenya Limited has its main office in Nairobi but carries out its operations in various counties in the Republic of Kenya.
Triggerise Kenya Ltd undertakes activities which are largely considered to be a charity in nature, Triggerise Kenya Ltd is in the process of registration as an NGO in order to comply with its core activities.
We are therefore seeking the services of an accounting consultant with sound NGO accounting experience to professionally advise and undertake the below-listed roles to the organization for a period of one year.
SCOPE OF WORK FOR PAYROLL, TAX & STATUTORY COMPLIANCE ASSIGNMENT.


Preparing monthly payroll and issuing payslips to staff and advise on a change in the tax regulations relating to payroll.


Managing I-tax platform for Triggerise, ensuring all tax liabilities are filed within the stipulated period & issuing P9 slips annually.


Submitting monthly returns to the statutory bodies - NHIF, NSSF, NITA, PAYE, & withholding tax.


Periodic Tax Compliance reviews on reporting and payments highlighting tax exposures identified & recommending ways of addressing the risks identified.


Assistance in Annual Audit for the payroll and other statutory compliance-related issues.


Handling expatriates tax issues & work permit renewal.


Renewal of the business license and city council compliance e.tc. Business trading license, Fire license


Carry out company secretarial services of filing the financial statements with the NGO coordination board.


TECHNICAL REQUIREMENTS
The qualified firm should exhibit the following:

Demonstration of experience and expertise of similar assignment with similar organizations by availing a company profile.
Providing an activity plan (project plan) of actions to achieve the objectives of the assignment, specifying budgeted hours, timelines and sequence for its consultancy procedure and level of staff to be assigned;
Incorporating CV's of the proposed professional staffs of the core management team proposed for the engagement and the authorized representative submitting the proposal. CVs should demonstrate relevant experience of dealing with similar assignment within organizations similar to Triggerise.
List of current and past clients where the bidder carried a similar assignment along with the name of the organization, contact person, designation, and a contact number, nature of the consulting services and length of the appointment for at least two (2) International non-governmental organizations.
Registration Certificate
Have relevant professional credentials
Tax Compliance Certificate.
Other relevant Certificates.

EVALUATION CRITERIA
Proposals will be evaluated in two parts.


The technical proposal weighted at 70%


Financial proposal weighted at 30%


Proposals should make clear about the relevant skills, experience and capacity of the participants involved in carrying out this assignment as per the provided SOW. It must contain the details of the proposed approach to be adopted in order to deliver the service in accordance with the SOW. Proposals should clearly indicate whether or not bid participants have the capacity to meet the requirements of the SOW and must be a registered firm in Kenya.
Functionality evaluation criteria

Experience, Skills and Ability of consultant

This will include

Past experience in similar work of this nature.
Team member experience (accompanied by brief CV's).
Bidders’ track record.
The ability of the bidder to fulfil the requirements

Weight: 30

Technical Approach and Execution

Proposals must contain the details of the proposed approach to be adopted in order to deliver the service in accordance with the TOR.
Bidder must allocate Senior Staff member for this engagement. The proposal should contain a work plan, showing tasks and timelines. Did the bidder submit clear proposed timelines for this engagement?
Weight: 30

References

Did the bidder submit at least three relevant and contactable clients that were serviced in the past 36 months.
Weight: 10

Capacity

Proposals should clearly indicate whether or not bid participants have the technical capacity to meet the requirements of the TOR based on the previous value of similar works done.
Weight: 30
TOTALS WEIGHT: 100
CONSULTANCY FEES
The fees for the consultancy services should be quoted separately, payment will be in accordance with a detailed budget breakdown as submitted through the proposal, and invoices will be expected from the consultant prior to payment.
"
"
Latest Jobs at University of Maryland
",Education ,"
Driven by the pursuit of excellence, the University of Maryland has enjoyed a remarkable rise in accomplishment and reputation over the past two decades. By any measure, Maryland is now one of the nat ",https://www.myjobmag.co.ke/jobs/latest-jobs-at-university-of-maryland,"
Under the general supervision of the facility in-charge, the Site Laboratory Technologist will perform routine clinical laboratory tests per prescribed procedures and acceptable practice pertaining to HIV/AIDS management, and general laboratory procedures.
Key Responsibilities

Manage laboratory equipment in serviceable condition at all times. Keep proper inventory and ensure good stock management for laboratory reagents.
Prepare the laboratory equipment and specimen for tests as necessary.
Ensure quality controls are done for respective procedures, and results properly documented.
Collect patients specimen for laboratory tests and analysis in the prescribed manner, with proper documentation, and ensuring safe handling and disposal of such specimen.
Analyze and record test results accurately and timely in order to issue reports for use by the physician/clinician.
Maintain an accurate database of tests carried out and generate reports on the same.
Develop, review and regularly update the standard operating procedures manual for administration of laboratory tests
Support waste management in the facility, through regular check on segregation of wastes generated at various service delivery points.
Perform any reasonable work related duties as may be assigned from time to time at the facility.
Provide appropriate education to patients (where necessary) on laboratory investigations.
Spearheads laboratory quality improvement through Implementation of laboratory quality improvement projects.
Prepare site monthly Laboratory reports.

Academic Qualifications:

· Diploma in Medical Laboratory Science Technology
· Higher National Diploma/Bachelors in Medical Laboratory Science Technology an added advantage

Professional Qualifications

· Registration with Medical Laboratory Technologist and Technicians Board
· Current Membership/Practicing License from the KMLTTB

Experience:
At least 3 years’ relevant experience

go to method of application »



(adsbygoogle = window.adsbygoogle || []).push({});
"
,,,,"
Under the general supervision of the facility in-charge, the Site Laboratory Technologist will perform routine clinical laboratory tests per prescribed procedures and acceptable practice pertaining to HIV/AIDS management, and general laboratory procedures.
Key Responsibilities

Manage laboratory equipment in serviceable condition at all times. Keep proper inventory and ensure good stock management for laboratory reagents.
Prepare the laboratory equipment and specimen for tests as necessary.
Ensure quality controls are done for respective procedures, and results properly documented.
Collect patients specimen for laboratory tests and analysis in the prescribed manner, with proper documentation, and ensuring safe handling and disposal of such specimen.
Analyze and record test results accurately and timely in order to issue reports for use by the physician/clinician.
Maintain an accurate database of tests carried out and generate reports on the same.
Develop, review and regularly update the standard operating procedures manual for administration of laboratory tests
Support waste management in the facility, through regular check on segregation of wastes generated at various service delivery points.
Perform any reasonable work related duties as may be assigned from time to time at the facility.
Provide appropriate education to patients (where necessary) on laboratory investigations.
Spearheads laboratory quality improvement through Implementation of laboratory quality improvement projects.
Prepare site monthly Laboratory reports.

Academic Qualifications:

· Diploma in Medical Laboratory Science Technology
· Higher National Diploma/Bachelors in Medical Laboratory Science Technology an added advantage

Professional Qualifications

· Registration with Medical Laboratory Technologist and Technicians Board
· Current Membership/Practicing License from the KMLTTB

Experience:
At least 3 years’ relevant experience

go to method of application »



(adsbygoogle = window.adsbygoogle || []).push({});
"
"
Invitation to Tender - Investment Attraction Firms at Tetra Tech
",Engineering ,"
Tetra Tech is a leading provider of consulting, engineering, and technical services worldwide. We are a diverse company, including individuals with expertise in science, research, engineering, constru ",https://www.myjobmag.co.ke/jobs/invitation-to-tender-investment-attraction-firms-at-tetra-tech,"
Role – Bungoma, Eldoret, Isiolo, Iten, Kathwana, Kerugoya/Kutus, Kisii, Kitui, Lamu, Malindi, Mandera, Wote, Kenya
Sustainable Urban Economic Development Programme (SUED)

Work with Kenyan Municipalities to build their capacity to plan and attract investments
Sep 2018- Aug 2022
Bungoma, Eldoret, Isiolo, Iten, Kathwana, Kerugoya/Kutus, Kisii, Kitui, Lamu, Malindi, Mandera, Wote -Kenya

The Programme
The British Government through the UK Department for International Development (DFID) is supporting emerging urban centres in Kenya through the Sustainable Urban Economic Development Programme (SUED). SUED is a £60 million, five-year programme, supporting 10 fast growing municipalities to develop sustainable urban economic plans and attract investment for critical climate-resilient infrastructure and value chain projects, to better harness inclusive economic growth.
The Position
SUED is inviting interested firms/consortium to submit tenders to offer investment attraction services ranging from completion of pre-feasibility studies to drawing in investors to fund specific projects in three municipalities in Kenya, namely: Kathwana, Kisii and Iten.
This will involve taking the projects all the way from conducting pre-feasibility studies to achieving financial close. The interested firms/consortium will be required to help the selected municipalities develop and implement investment promotion strategies and draw in investors to fund commercially bankable climate-resilient infrastructure and value chain projects identified in their urban economic plans. The preferred supplier is expected to provide all the needed support, inputs, documentation, services and content for the project to achieve successful financial close.
The Firm/Consortium
Interested firms/consortium will be required to demonstrate the following in their response to this ITT:

In-depth experience in the provision of investment attraction and/or transaction advisory services;
Ability to work at national or sub-national level in Kenya or similar setting;
Ability to conduct pre-feasibility studies across a range of sectors in various municipalities in Kenya;
Ability to develop and implement investment promotion strategies;
Extensive networks within the investing community (both public and private);
Experience in developing match-making platform for investors and those seeking capital to connect on active deals;
Expertise in structuring various types of investment transactions including use of early stage/seed financing vehicles.

The details and full scope this ITT including can be found on https://www.suedkenya.org/opportunities
"
"
Fresh Jobs at Islamic Relief Kenya
",NGO ,"
Islamic Relief Worldwide is an international humanitarian organisation that provides development programs and humanitarian relief around the globe, regardless of race, political affiliation, gender or ",https://www.myjobmag.co.ke/jobs/fresh-jobs-at-islamic-relief-kenya,"
PSI seeks a Senior Cost & Pricing Officer to lead cost and pricing strategies and risk analysis for new bids and proposals and lead the budget development process for bids and proposals in coordination with headquarters-based programmatic and New Business Development (NBD) teams and overseas field teams. The successful candidate will ensure full recovery of direct and indirect costs in budget presentations to funders, align budget and budget narrative templates with funder requirements and PSI policies and procedures, and support realignment of existing project budgets as needed. The Senior Cost & Pricing Officer will be familiar with budget development for various types of funders in the field of international development.
This position will be based in Nairobi, Kenya or Washington, DC or may telework from anywhere within the USA. The Senior Cost & Pricing Officer will report to the Senior Manager, Cost & Pricing.
Sound like you? Read on.
Your contribution

Review funder solicitations and research additional financial guidance as needed to analyze and fully understand cost proposal requirements for new bids and proposals; prepare questions to submit to funders if further clarification is needed; and develop or modify existing budget and budget narrative templates to align with solicitation requirements.
Communicate budget issues or concerns with solicitation requirements to internal stakeholders, such as Finance, programmatic teams, Grants & Contracts, and NBD, for timely discussion and appropriate mitigation.
Analyze financial and cost recovery risks and recommend mitigation strategies; and perform surplus-deficit analyses on proposal budgets.
Review, or lead as assigned, new proposal and project realignment budgets and budget narratives to ensure quality, compliance with funder and PSI requirements, and full cost recovery.
Provide guidance in the development of cost-related responses to post submission questions and award budget negotiations.
Train non-C&P staff on various cost and pricing topics and full budget and budget narrative development.
Periodically update funder specific budget and budget narrative templates and associated training materials.
Perform other duties as assigned.

What are we looking for?
The candidate we hire will embody PSI’s corporate values:
Measurement: Evidence, research, metrics, and evaluation inform our choices.
Pragmatism: We strive for excellence, but useful and timely are better than perfect.
Honesty: We act with integrity, share what we achieve, and admit when we fail.
Collaboration: Active partnering drives impact.
Trust: We have confidence in our people to make good decisions.
Commitment: We build local capacity and programs that last.
Basics

A minimum of Bachelor’s degree in a relevant discipline and eight (8) years of work experience in a similar role or relevant budget development role.
Experience developing proposal budgets for a variety of government and non-government funders in the field of international development.
Strong computer skills and advanced ability working with MS-Excel and MS-Word.
Excellent interpersonal, written, and verbal communications skills.
Flexibility to assume a workload that often necessitates an adjustment of priorities.
References will be required.
Must have legal authorization to work in the location of employment. PSI will not consider work visa sponsorship for this position.
The successful candidate will be required to pass a background check.

What would get us excited?

You have experience developing cost proposals for USAID and PSI’s other major funders, such as DFID, Gates Foundation, the Global Fund, and KfW.
You have French and/or Spanish language skills.
You have experience preparing and presenting in-house training sessions. The C&P team presents trainings several times a year on various budgeting topics.
Need to be able to work well in a team environment and support team members by balancing the workload.


go to method of application »



(adsbygoogle = window.adsbygoogle || []).push({});
"
