job_title,job_category,job_description,job_link,job_detail
"
Transactional Accounting Manager at CA Global
",Consulting,"
CA Global Headhunters is an international recruitment and staffing company with an in-depth focus on Recruitment in Africa. We recruit talent of the highest standard across African Sectors in Mining, ",https://www.myjobmag.co.ke/jobs/transactional-accounting-manager-at-ca-global,"
Reference Number: 53 03 20 MNW
 
Job Description: 
Our client, a successful mining and manufacturing company is looking for a Transactional Accounting Manager who will lead the processing, posting and payment of internal and external vendor invoices and fund requests. They will have a keen attention to detail, appreciate and ensure a structured and disciplined method and approach as well and demand continuous improvement.
 
Responsibilities: 

Manage the processing of payments, fund transfers and journal postings of internal and external vendor invoices
Oversee the function for payments categorization and transactions into Capex and Opex, and ensure accurate reporting in the financial systems, including correct treatment of VAT, WHT and other applicable taxes
Drive the improvement of departmental performance by evaluating processes to drive efficiencies in various transaction and payment process metrics
Supporting the Reporting and Control functions with in-depth transactional analysis
Prepare presentations to Functional Heads and Senior Management Team 
Manage the delivery of ad hoc projects impacting transaction and payment process enhancements
Liaison with internal and external auditors and provide relevant information when required
Timely preparation and ownership of reporting, consolidation and forecasting preparation processes 

 
Requirements: Qualification and Skill

Bachelor’s degree in finance, accounting or business-related courses
Qualified Chartered Accountant (ACA, ACCA, ICAN)
7+ years’ experience in finance with a focus in finance operations for manufacturing organizations. Cement or FMCG Sectors will be an advantage
3 years progressive supervisory/leadership experience
Understands IFRS and public company regulatory reporting/filing requirements
Exceptional verbal and written communication skills
Strong stakeholder engagement, influence and negotiation skills
Exceptional project management skills 
Business acumen – shows understanding of issues relevant to the broad organization and business; keeps the knowledge up to date and uses cross-functional knowledge
Exposure and knowledge of ERP applications. Experience with SAP will be highly advantageous.

Benefits and Contractual information:

Permanent

"
"
National Sales Manager – Juice Company at Corporate Staffing Services Ltd
",Consulting,"
Corporate Staffing Services is a leading recruitment agency in Kenya providing complete recruitment services.
In the last ten years we have been partners to local and foreign businesses looking to ",https://www.myjobmag.co.ke/jobs/national-sales-manager-juice-company-at-corporate-staffing-services-ltd,"
Report to: Managing Director
Gross Salary: 200k – 250k
Location: Nairobi
Our client is an established juice manufacturing company. They seek to hire a National Sales Manager who will be in charge of all the sales activities and driving sales volume to achieve the set targets
Responsibilities

Driving the achievement of the sales targets as per the overall company targets whilst building long term tree top brand equity.
Identifying objectives, strategies and action plans to improve short term and long-term sales volumes/value and the gross profit.
Development and implementing of sales strategies and action plans to penetrate New Markets to ensure profit maximization.
In charge of the entire sales team; monitoring and reviewing their performance as per the agreed targets and providing feedback and review reports
Develop and implement a collection plan geared towards ensuring collection targets are achieved and cash flow levels are maximized as per the trading terms
Prepare and submit accurate and timely weekly, monthly and quarterly sales reports
Growth of the customer base

Qualifications

Bachelors’ degree in Commerce, Marketing, Business Administration or other relevant field.
At least 5 years relevant experience, in Sales & Marketing in an FMCG
Masters’ degree is an added advantage
Enthusiastic and passionate in sales

"
"
Administration Coordinator (Kenyan National hire only) at Church World Service
",NGO ,"
Church World Service (CWS) was founded in 1946 and is a cooperative ministry of 37 Christian denominations and communions, providing sustainable self-help, development, disaster relief, and refugee as ",https://www.myjobmag.co.ke/jobs/administration-coordinator-kenyan-national-hire-only-at-church-world-service,"
Grade:              10 (N)
Level:               Level 3 Manager
Division:          Administration
Department:     Administration
Primary Purpose
The position reports to the Deputy Director for Administration and directly oversees the General Services department, which includes Procurement, Property, and Logistics.  In support of the Deputy Director for Administration, this position also oversees and supports the planning, training, quality control, monitoring and evaluation of the other Admin units, which include IT, HR, and Finance. This position works closely with the Programs Coordinators and is an active participant in RSC Africa’s Leadership Team.
 
Supervision
This position supervises the Procurement, Property, and Logistics Supervisors. This position reports directly to the RSC Africa Deputy Director for Administration.
 
Essential Duties
 
Management

Provides direct supervision, training, and feedback to Procurement, Property, and Logistics Supervisors
Develops policies and standard operating procedures (SOPs) to ensure the accountability, transparency, and efficiency of RSC Africa, and to ensure compliance with the Cooperative Agreement, relevant United States Government (USG) and CWS policies
Oversees the process of monthly Admin projections, including procurement, anticipated travel projections and related accountability forms, and ensures compliance with US government requirements
Ensures Administration Division SOPs are routinely updated, stored, and disseminated electronically and via in-person training sessions
Works closely with Senior Programs Team to plan work, resolve issues, conduct root cause analysis, and ensure systems improvements
Supports General Services and other Administration departments with budget preparation
Supports the Deputy Director for Administration by ensuring the Administration Division meets all division deliverables with high quality and on time or early
Develops internal Compliance Reporting for all Administration divisions
Works closely with Finance Manager and Deputy Director for Administration to perform regular internal audits and compliance checks
Ensures Administration division’s compliance with Fileserver organization and group email protocols
Ensures that SOPs for the Administrative departments are always up to date with Senior Management Team directives, and in line with RSC Africa security policy and that the administrative staff receive relevant security training.
Plans and executes annual process reviews for all Administrative departments
Ensures there is an organized and robust training strategy for the Administration Division, inclusive of targeted capacity building to increase professional skills of Administration positions
Reports on Administration division’s multi-year planning progress and challenges
Liaises with the Compliance Coordinator, Management and Training Coordinator and Sub/Satellite Office Management to ensure Sub/Satellite offices are compliant with the Cooperative Agreement and relevant USG and CWS policies
Reviews contracts and coordinates timelines around contract negotiations, request-for-proposals, and other tenders to ensure a deliberate and timely delivery of services
Supports with property management and/or landlord concerns in Kenya, South Africa, and Tanzania, or other areas of operation
Participates actively in RSC Africa Leadership Team and at times attends SMT meetings

 
Budget

Along with the DDA, prepares the annual RSC Africa budget and revisions, and monitors expenses in accordance with authorized budgets
Ensures cost-effective use of RSC Africa human and financial resources, including a monthly review of expense reports and financial projections with RSC Africa unit supervisors

 
Physical Assets

Supervises the requisition, maintenance, and inventory of expendable and non-expendable equipment
Provides Quality Control checks on Purchase Orders to ensure correct budget line allocation and that all information and supporting documents are adequate and correct
Reviews all contractual agreements for goods and services, equipment and insurance, and maintains copies of all relevant contracts
Ensures that all adequate insurance is arranged for all property and personnel and other liabilities in accordance with US and Kenyan laws
Ensures that adequate inventory levels are maintained for all supplies
In conjunction with the Property Supervisor, liaises regularly with the property management company to ensure services are delivered and accounted for properly 

 
Human Resources

Provides support as requested to the human resource functions of RSC Africa including staff recruitment, training and performance management, interpretation and implementation of RSC Africa personnel policies, and administration of payroll and employee benefits
Provides support as requested to ensure that RSC Africa has a robust strategy for using information technology to increase the efficiency and effectiveness of its work across the organization.

 
Other Functions

Serves on the RSC Africa Safety and Security Management Team
Other duties that may be assigned to enhance the quality and efficiency of the administration of operational programs to attain program objectives and maintain the high professional standards of RSC Africa and CWS

 
Qualifications
 
Education

Bachelor’s Degree in Finance, Accounting, Business Administration, Public Administration or a related field is required.
Master’s Degree preferred.

Experience

Minimum of five (5) years of management experience, with seven (7) years preferred, with an international NGO in a similar position required.
Proven experience with financial management on US federal government funded projects and knowledge of US federal government financial regulations required.
Knowledge of Kenya laws and customs preferred.
Experience with overseas processing or US refugee resettlement preferred.

 
Knowledge/Skills:

Strong computer skills, in particular Microsoft Excel, Word, Outlook and Access required
Excellent organizational and time management skills
Strong verbal and written English language skills

 
Abilities:
The Administration Coordinator must have the ability to:

serve as a coach/mentor to staff;
supervise staff to ensure policies and procedures are implemented and executed in accordance with guidelines and standard operating procedures;
exercise good judgement and seek guidance as appropriate when confronted with unanticipated problems;
travel in sub-Saharan Africa on short notice and often under difficult conditions to meet demands of a dynamic program;
communicate effectively both verbally and in writing;
follow instructions with a positive and receptive attitude;
deal effectively and courteously with a large number of associates, outside agencies, refugees and members of the general public;
conduct oneself in a professional and courteous manner to represent the best interests of RSC Africa and CWS;
maintain a high performance standard with attention to detail;
carry out all of the duties of the position efficiently and effectively with minimal supervision;
work independently and contribute to overall operations of RSC Africa; 
take initiative in the development and completion of projects within the specified timeframe;
maintain strict confidentiality with RSC Africa administrative and operational information;
manage a large and diverse workload under pressure with competing priorities;
work well as a team in a multi-cultural environment while maintaining a high level of motivation. 
effectively manage RSC Africa’s resources; and
actively contribute to the successful implementation of the U.S. Refugee Admissions Program (USRAP).

 
Working Conditions
Physical: This position requires bending, squatting, crawling, climbing, kneeling, sitting, standing, walking, pushing/pulling, handling objects (manual dexterity), reaching above shoulder level, using fine finger movements and lifting/carrying heavy loads.
 
Environmental: The incumbent in this position may be exposed to excessive noise, marked changes in temperature and/or humidity, dust and infectious diseases, harsh weather climates, long work hours, bumpy roads, extended travel, excessive sun exposure, and non-ventilated spaces.
 
The US Embassy rates Kenya as both HIGH in crime and HIGH in terrorism.  The incumbent should fully understand the insecurities present within Kenya and the region.
 
Special Requirements: 
Certificate of Good Conduct issued within the last one year (12 months) is required before the start of employment. A background check which includes references and an educational and criminal check is also required before the start of employment. A valid passport and the ability to maintain a valid passport throughout the entire appointment is required, which includes having enough passport pages for travel.  The candidate should be of good health, willing and able to travel extensively in often difficult conditions, and have a high degree of flexibility. Must have proof of Yellow Fever vaccination before traveling for RSC Africa. Employee will be entrusted with the receipt, custody and payment of money. 
 
Licensing/Certification:  N/A
 
Competencies
Communication 
Ensure effective exchanges of information with others.  Examples of skills and behaviors include speaking to others respectfully; expressing ideas in a logical, organized way; sharing information appropriately; and clarity and conciseness in written communication.
Relationships
Ensure constructive and supportive interactions with others. Examples of skills and behaviors include being positive and supportive when working with others; sharing information and resources freely; resolving conflict constructively; and proactively working to remove obstacles to success for others.
Job Knowledge
Utilize and apply job related knowledge to complete job tasks at a level that meets or exceeds expectations.  Examples of skills and behaviors include utilizing job knowledge to solve problems or develop new approaches; maintaining or enhancing skills through continuing education; and taking on projects that will develop or enhance skills.
 
Teamwork
Work effectively and contribute as a member of a team.  Examples of skills and behaviors include supporting other team members by sharing information; covering the work of others during absences, vacations etc.; and actively participating in developing ideas for ways to increase team effectiveness.
 
Problem Solving  
Analyze information and develop solutions to challenges that arise during the course of performing a job.  Examples of skills and behaviors include researching and collecting facts; defining the issues and the parties affected; formulating options/solutions for addressing the problem; and engendering support for and implementing the solution.
 
Operational Leadership
Successfully lead a group to achieve operational goals.  Examples of skills and behaviors include priority setting; timely decision making; planning and organizing; delegation; and managing and measuring work.
 
Building and Leading Effective Teams
Earn the respect of team members, create strong morale and spirit on the team and utilize the unique skills of all team members. Examples of skills and behaviors include managing diverse relationships; flexibility; being open and receptive; running effective team meetings; and exhibiting integrity and trustworthiness.
Strategic Leadership
Accurately anticipate future consequences and trends and translate them into the fulfillment of workable strategies and plans.  Examples of skills and behaviors include problem solving; dealing with ambiguity, creativity; innovation management and business acumen.
"
