job_title,job_category,job_description,job_link,job_detail
"
Job Openings at Islamic Relief Worldwide
",NGO ,"
Islamic Relief Worldwide is an international humanitarian organisation that provides development programs and humanitarian relief around the globe, regardless of race, political affiliation, gender or ",https://www.myjobmag.co.ke/jobs/job-openings-at-islamic-relief-worldwide,"
Job description
Reporting to the Regional Director the Regional Food Security and Livelihoods Advisor has the responsibility to ensure Islamic Relief food security, livelihoods and resilience building programmes in our operational countries in East Africa that are of high quality and impact focused. The post holder will assist the Regional Director in ensuring that learning and innovation is disseminated across Islamic Relief and beyond. The post holder will engage strategically to build in-country and regional partnerships and influence thinking in the resilience building, food security and livelihoods sector. Key deliverables will be leading on developing FSL sector strategy which provides strategic framework to our programmes, increased fundraising, and building capacity of national staff to ensure IR delivers impactful projects and programmes
Responsibilities

TECHNICAL LEADERSHIP AND STRATEGY **

Develop future FSL programme strategy in close coordination with the FSL national teams, and create and refine operational planning and supportive budget. .**
Provide technical expertise and knowledge to ensure that food security and livelihoods interventions, including cash based interventions, voucher programming, and in-kind food basket distribution and economic strengthening interventions meets appropriate minimum and technical quality standards. **
Coordinate and/or lead relevant assessments including the Household Economic Assessment (HEA) approach (needs and baseline assessments) and emergency market assessments. **
Contribute to situational analysis for identifying livelihoods protection and recovery needs, with due consideration for cross cutting issues within all interventions.


PROGRAMME IMPLEMENTATION AND MANAGEMENT

Oversee the implementation of the Livelihood & Food Security projects in in East Africa countries, ensuring timeliness and delivery according to the activity plan and results frameworks.
Manage the Livelihoods and Food Security activities ensuring that it is meeting its intended aims and objectives and achieving impact.
Assure full compliance of operations with IRW’s principles, rules, regulations and policies, operational strategies and relevant reference documents and policies (Sphere, Do no harm).


MONITORING, EVALUATION, LEARNING AND ACCOUNTABILITY

Conduct need assessments, baseline surveys, feasibility studies ensuring that sound methodologies are employed and that the findings inform the formulation of winning grant applications.
Conduct real-time evaluation and impact assessment in relation to food security and livelihoods programmes in conjunction with the Country Programme M&E Coordinators and Global Monitoring and Evaluation, Accountability and Learning unit
Spearhead innovations in the field of food security and livelihoods including introducing technologies and new ways of working in order to deliver lasting impact on the people the organisation serves.


FUNDRAISING, REPRESENTATION AND NETWORKING

In collaboration with country-based sector specialist, lead the development of competitive, long-term and impactful resilience building, food security and livelihood proposals
Develop skills and capacity of IR staff who work in food security and livelihoods projects in East Africa
Represent IR to regional and global relevant networks, high level meetings and working groups
Contribute to research, policy development and advocacy at a regional and global level
Lead partnerships with relevant academic institutions, networks, think tanks, corporate companies and other stakeholders in East Africa region.


CAPACITY DEVELOPMENT

Develop skills and capacity of IR staff who work in food security and livelihoods projects in East Africa
Provide leadership, coaching and mentoring to staff under indirect management, ensuring that they have clear objectives and receive meaningful feedback on their performance and development.
To be successful in this role you will have strong specific technical/professional knowledge from formal training and/or work experience, an in-depth understanding of supporting potential sustainable livelihoods options through market-led interventions for different livelihoods groups, especially promoting economic leadership as well as proven skills in emergency food security and livelihoods interventions and policy issues.
You should also have some understanding of disaster preparedness, DRR and Climate Change Adaptation in drought affected communities and knowledge of cash and market related methods of delivering assistance to disaster affected people. You will need to demonstrate ability to work creatively, innovatively and effectively. Good communication skills and demonstrated skills in training and mentoring others are a must for this position. Experience as a team worker and demonstrable inter-personal skills are highly valued for this position,



Qualifications

Higher University degree in Agriculture, Agricultural Economics, Rural development or any other related fields.
An extensive hands-on experience related to food security and livelihoods with International NGOs at senior level (for example, Technical Advisor, Sector Head/ Thematic head)
In-depth understanding of livelihoods frameworks, theory of change and logical frameworks/intervention logic of some of the major institutional donors and foundations
A proven track record of successful proposal development for bilateral donors such as DFID, ECHO, Europe aid, SIDA, CIDA, USAID etc for rural development, food security, livelihood programmes
Proven track record of developing strategies, evidence-based research papers, and advocacy at national level
In-depth understanding of supporting potential sustainable livelihoods options through market-led interventions for different livelihoods groups, especially promoting economic leadership as well as proven skills in emergency food security and livelihoods interventions and policy issues.
Ability to think strategically, achieve results and innovate.
Excellent report writing skills and analytical skills
Fluency in English, both spoken and written
Knowledge of national languages (Swahili, Somali, Amharic, Arabic) spoken in the region is an asset.
Ability to work in a multi-cultural environment.
Ability to work in a multi-cultural environment.
Willingness to travel to hard to reach and insecure locations
Interpersonal skills and team player


go to method of application »



(adsbygoogle = window.adsbygoogle || []).push({});
"
"
Country Representative at Options Consultancy
",NGO ,"
Options Consultancy Services Limited is a consultancy organisation providing technical and management expertise in the health and social sectors to governments and international development partners t ",https://www.myjobmag.co.ke/jobs/country-representative-at-options-consultancy,"
Job description
Options Consultancy seeks a Country Representative for Kenya to lead the team and execute of Options’ strategy. This new role would offer the successful candidate the opportunity to help shape and grow Options in Kenya (and regionally), ensuring we maintain and strengthen our reputation for delivering high quality programmes in the health sector.
Responsibilities:

Drive strategic growth for Options in Kenya (and regionally)
Ensuring Options’ effective operation in Kenya
The Country Representative will be responsible for identifying, developing and delivering new business opportunities in Kenya (and regionally) and externally representing Options, increasing brand awareness and recognition.
The post holder will oversee Options’ operations within Kenya and have oversight of some of our national programmes.

Qualifications
To succeed in this role, you will have:

· Master level qualification or degree in a relevant subject area (Business, Health, Leadership/ Management)
· Previous executive-level experience (Country Director/Rep, Executive Director, Departmental Head)
· Track record in successful business development in relevant areas
· Track record of leadership that demonstrates integrity and transparency
· Strong manager and leadership with a thorough understanding of operations
· Knowledgeable in our areas of operation, credible in the Kenyan health sector
· Willing to travel domestically and internationally (25%)

"
"
Program Officer at Network of African National Human Rights Institutions (NANHRI)
",NGO ,"
The Network of African National Human Rights Institutions (NANHRI) is a regional umbrella body that brings together 44 African National Human Rights Institutions. NANHRI, whose Secretariat is based in ",https://www.myjobmag.co.ke/jobs/program-officer-at-network-of-african-national-human-rights-institutions-nanhri,"
Reports to: Operations Manager
Location:  Head Office with occasional travels in the region
Duration:  Nine (9) months with a possibility of extension.
Job description
To provide programme management support to NANHRI primarily to strengthen the capacity of National Human Rights Institutions to operationalize and institutionalise the Resolution 275 of the African Commission on Human and Peoples’ Rights. This will involve direct implementation, management and coordination of the assigned programme’s activities to ensure that NHRIs expand the protection space for sexual and gender minorities.
Responsibilities

Coordinating the implementation of the programme activities
Ensuring programmes are effectively and efficiently implemented, including handling all the programme
Supporting the Operations Manager in preparing concept notes and funding
Maintaining and developing relationships with key programme stakeholders and partners in close coordination with the Operations Manager and other NANHRI
Coordinating internal programme monitoring and evaluation
Preparing periodic programme progress reports as and when necessary to be submitted to donors
Coordinate regular communication with programme stakeholders and
Participating in internal and external programme planning processes
Researching and documenting issues pertaining to the programme theme

Qualifications

At least a Bachelors Degree in Social Sciences, Human Rights Law, International Relations, Development studies or other related field. A Masters Degree in relevant field will be an added
Three years experience in the human rights and social justice field. Experience working in advocacy and legislation will be an added
Understanding of human rights particularly as they relate to sexual and gender minorities
Excellent research, report writing and presentation skills
Excellent computer skills in various computer packages
Excellent working knowledge of English; a good working knowledge of French will be an added advantage
Good communication and interpersonal skills
Good organizational and analytical skills
Ability to work under pressure and to meet deadlines

"
"
Technical Sales Rep at Morison Engineering
",Engineering ,"
Morison Engineering Limited (MEL) is a leading supplier of engineering products in the region. ""Atlas Fire Security” a Division of Morison Engineering Ltd has been in existence for close to thre ",https://www.myjobmag.co.ke/jobs/technical-sales-rep-at-morison-engineering,"
Job description
Our client, a well-established Company that provides safety solutions is looking for a Technical Sales Representative  for selling generator, generator parts, generator services and related electrical works as well as Fire alarm and detection system and plumbing items. We are a leading supplier of engineering products in the region. We have been in existence for close to three decades and we are synonymous with Generators supply, servicing and maintenance as well as Air conditioning and refrigeration inmany Kenyan businesses and residences. The Company distributes high quality equipment from a number of industry leading companies from around the world which conform to international standards and certified by Kenya Bureau of Standards. We are seeking to hire a dedicated and commited Sales Executive who will be responsible for sales, marketing, and business development of generator sales, generator parts, generator services and related electrical works as well as Fire alarm and detection system and plumbing items
Responsibilities

Generating leads, growing sales and market footprint in company
Gaining knowledge of new building developments in Kenya
Contacting potential customers and building relationships with electrical engineers, contractors and architects
Reporting on competitors and their activities in the market
Building long term relationships with new and existing customers
Distributing product catalogues brochures and leaflets
Conducting marketing activities in the region
Providing pre-sales technical assistance and product education
Following through on sales orders and delivery of products
Demonstrate the company products with authority

Qualifications

Bachelor’s degree Electrical Engineering or a minimum of Higher National Diploma in the same or Engineering related Discipline
At least 2 years sales experience in Engineering products and services will be an added advantage
A proven ability to drive sales and generate new business
Registration with the necessary professional  bodies
Ability to achieve sales targets
Confident, well spoken, ambitious and driven
Able to work under pressure and meet deadlines
Ability to work independently and self-motivated
A good grasp of computer skills
Possess high sense of integrity and confidentiality

"
"
Attachment Programme at Base Titanium Limited
",Oil and Gas ,"
Base Titanium Limited is a wholly-owned subsidiary of Australian and UK-listed resources company, Base Resources Limited (ASX and AIM: BSE). Its flagship development is the Kwale Mineral Sands Project ",https://www.myjobmag.co.ke/jobs/attachment-programme-at-base-titanium-limited,"
General conditions: 
The contract shall be read in conjunction with the Industrial Training Act  Cap 237 Laws of Kenya.  Specific Conditions:
The Industrial Attachee shall: 

Obey and observe all industrial/site  safety rules and regulations;
Serve the employer diligently  and obey all lawful instructions  of  the employer; 
Not divulge any of the employer’s  classified information; 
Not absent himself/herself during normal working hours without the  permission  of the employer;
Not engage in any other form of employment  during working  hours; 
Attend such classes or take such correspondence courses as the employer may require; 
Avail himself/herself for continuous assessment by authorized persons to determine his/her achievement; 
Complete  all assignments  given by the trainer on time; 
Maintain  the insurance cover for the period of attachment;
Cooperate with fellow employees at work. 

The Employer shall:

Give the attachee proper induction and orientation of the Organization; 
Place the attachee under a qualified and competent trainer;
Provide necessary tools/equipment and materials during the period of    attachment; 
Provide the best possible and diversified experience to the attachee. 
Assess the attachee using the provided assessment criteria and guidelines. 
Furnish NITA with reports on progress and conduct of the attachee on the prescribed Form(s) and format. 
Provide necessary security and protection to the attachee.
Allow  adequate access by the supervisor to assess the attachee.                                                                    

"
"
Supply Chain Production Business Partner at Unilever
",Manufacturing ,"
On any day, 2 billion people use Unilever products to look good, feel good and get more out of life - giving us a unique opportunity to build a brighter future.
Great products from our range of mor ",https://www.myjobmag.co.ke/jobs/supply-chain-production-business-partner-at-unilever,"
Main Job Purpose
Key business partner to supply chain leadership team whose main responsibilities are:

Translate Supply chain strategies into financial plan
Business performance management delivering high quality insights facilitating effective decision making
Scenario analysis on innovations and capital investments

Job Summary

Translate Supply chain strategies into financial plan and monthly financial forecast
 Ensure weekly tracking of supply chain performance against forecast
Identify value opportunities that require a particular intervention / project support from Finance Business Partner resources
Evaluate projects in process to ensure they have a favourable payback and return on investment
Drive better decision making around resource allocation and budget setting
Undertake major performance interventions if needed
Support supply chain team at the key decision gates of innovation business cases
Review impacts of performance interventions
Identify major risks and opportunities
Facilitate development of corrective actions to close gaps to targets
Facilitate identification and implementation of savings opportunities
Ensure that a robust Capex expenditure process is in place and enforced

Business partnering and insight

Collect data for base assumptions and liaise with Supply Chain, and relevant cross functional teams to build the base business case and sensitivity analysis
Perform Business Case modelling (or facilitate self service) and articulate business case characteristics to non-Finance stakeholders
Provide support in innovation funnel review analysis
Embed the rigour, discipline and continuous improvement around Post-Launch Evaluations (PLEs) for implemented projects
Provide insights to MCOs and Categories on innovation performance, contribution to company growth, PLE earnings and innovation trends

Process ownership and delivery

Act as subject matter experts in building Innovation Business Cases
Track Business Case (BC) progress including CAPEX projects
Own the BC tool and seek continuous improvement, simplification & standardisation
Build proactive Innovation Performance Management capabilities - maintain and continuously improve self-service tools and reports to track delivery of Innovation Business Cases (e.g. in market performance of key launches)
Provide training to Business Partners on standard Business Case tools
Develop a knowledge repository of best practices and share learnings with categories and countries

Key Requirements

A Bachelor’s degree and professional qualification CPA/ACCA
4-5 years’ experience in finance business partnering with at least 1 year in manufacturing or supply chain
Experience with the identification of risks & opportunities in the P&L
Experience in driving P&L performance improvements (e.g. closing gaps vs. target) and holding others accountable (particularly peers and senior leadership)
Significant experience managing a large and complex set of stakeholders
Experience in presenting to and communicating with senior Finance and non-Finance stakeholders
People management
Stakeholder management
Strong analytical skills, Excel modelling skills and attention to detail
Strong organisational and prioritisation skills
Strong engagement, presentation and communication skills
Ability to work fluidly with data and across systems
Ability to present complex information in a simplified manner
Qualified accountant or equivalent
Influencing skills

"
"
Grants Internships at African Wildlife Foundation
",Travel and Tours,"
The African Wildlife Foundation, together with the people of Africa, works to ensure the wildlife and wild lands of Africa will endure forever. ",https://www.myjobmag.co.ke/jobs/grants-internships-at-african-wildlife-foundation,"
Job description
AWF is seeking a dynamic and high performing intern to support the Grants Management Team (GMT) with Awards data entry into the Serenic Accounting System. To be successful in this position, the successful candidate will be   self-motivated, capable of working with minimum supervision, high numerical accuracy and demonstrate high levels of integrity and good work ethics.
Responsibilities

Entering award estimate budget in Award Vision in accordance with;


approved work plan
approved personnel budget by employee
approved donor annualized budget


Enter award estimate budget by donor annual years
Update award obligations in Award Vision
Update award reporting milestones in Award vision
Documents filling in AWF box storage according to checklist to provided
Any other duties as delegated by the supervisor

Qualifications

At least CPA II or any other professional accounting qualification
An undergraduate degree in Accounting will be an added advantage
Familiarization with government regulations.
At least 6 months experience in a similar position
Excellent knowledge of Microsoft Excel spreadsheets
Ability to work as part of a team.
Strong written and verbal communication skills
Ability to effectively manage multiple tasks and to prioritize them.
Demonstrated interest and understanding of key concepts in administrative support services.
Ability to work with minimal supervision

"
"
Technical Advisor at ICAP Columbia University
",NGO ,"
A global health leader situated at Columbia University, ICAP has worked since 2003 with one central goal: to improve the health of families and communities.
Working hand-in-hand with individuals at ",https://www.myjobmag.co.ke/jobs/technical-advisor-at-icap-columbia-university,"
Job description
ICAP of Columbia University (registered in Kenya as Center for International Programs- Kenya) is working in partnership with the Ministry of Health to strengthen HIV Prevention, Care and Treatment services in Kenya. Applications are invited for the following positions.
Reporting to the Regional Director, the Technical Advisor – HIV Prevention, Care & Treatment is a member of the  senior  team  and  will  oversee  programmatic activities and site support at Jaramogi Oginga Odinga Teaching & Referral Hospital (JOOTRH) for efficient delivery of quality services.
Responsibilities:

To oversee the planning, initiation and implementation of HIV Prevention, Care and Treatment services
To provide technical support for the planning and implementation of TB/HIV activities
To provide technical support for the planning and implementation of HIV testing services
To provide on-going supervision of ICAP-supported HIV care and treatment programs
To participate in training and mentorship of site facility staff
To participate in designing programs to assist in monitoring and evaluation and quality improvement activities
To liaise with Ministry of Health officials and other stakeholders in coordinating the implementation of the program
To prepare budgets, work plans, reports and other technical papers

Qualifications

Degree in Medicine or Diploma in Clinical Medicine
At least 5 years of experience with HIV-related health programs

"
"
Field Sales Executive at HRM Connection
",Consulting,"
HRM Connection Ltd has been serving a wide variety of industries as a human resource advisor, consultant, and on-site human resources department since 2010 ",https://www.myjobmag.co.ke/jobs/field-sales-executive-at-hrm-connection,"
Job description
Seeking an experienced field sales executive to attract new clients, win new accounts, and maximize profitability within his or her sales territory. Candidates will work prospects through the entire sales cycle, including developing new leads, educating prospects, and turning interested shoppers into long-term customers. Monthly salary paid will be inclusive of a retainer and commission.
Responsibilities 

Close new deals at a high rate
Build relationships with existing customers
Cultivate new leads within the sales territory
Travel throughout the territory and visit customers on a recurring basis
Manage multiple accounts simultaneously
Maintain records of all sales leads and/or customer accounts
Represent the brand during all customer and prospect interactions
Provide a concise description of the products and services to the customers and also drawing attention to the benefits
Monitor the company’s industry competitors, new products, and market conditions, including prices of products and the demand.
Totally focus on increasing the business by making various sales targets and estimating sales targets

Qualifications

Bachelors’ degree in sales and marketing or related field
3 – 4 years proven work experience as a salesperson
Should be competitive and confident
Should be able to take initiatives and work on their own to achieve targets.
Be a good team player.
He/ She should be excellent with both verbal and written communication.
Should have good knowledge of the industry and should be good with numbers to be able them to work on financial reports.

"
